{
  "event_id": "event:no-alternative-example",
  "occurred_tick": 10000,
  "actor_id": "asset:rover-v0",
  "subject_id": "directive:hydrate-primary-r0",
  "event_type": "endpoint-state-changed",
  "payload": {
    "asset_id": "asset:rover-v0",
    "from": "safe-hold",
    "to": "locked",
    "cause_id": "contestation:no-alternative-example",
    "reason_code": "no-safe-alternative",
    "budget_used": {
      "duration_ticks": 10000,
      "traverse_mm": 200000,
      "energy_units": 10000,
      "tier2_bytes": 250000
    }
  }
}
